resourceIdentifier,resourceName,country,protocols,protocolSubCategories,estAnnualEmissionReductions,M4_tight,n_tight,M4_methodology,n_methodology,M4_subcat,n_subcat,M4_range
4746,Carbono Rural Paraguayan Chaco,Paraguay,VM0042,ALM,268028,1.0,1,0.6108597285067874,221,0.7815533980582524,618.0,0.3891402714932126
4747,Pantanal REDD+ Program,Brazil,VM0007,REDD,187718,0.3684210526315789,38,0.3644067796610169,118,0.3890675241157556,311.0,0.024660744454738703
4748,RESTORED PRODUCTIVE LANDSCAPES IN THE MAGDALENA RIVER MIDDLE BASIN IN COLOMBIA,Colombia,AR-ACM0003,ARR,231,0.07692307692307693,13,0.0364963503649635,274,0.03041144901610018,559.0,0.046511627906976744
4749,TAJIMAT PUJUT - El buen vivir - Restauración y conservación de los bosques Awajún del Alto Mayo,Peru,VM0047; VM0048,ARR; REDD,292712,1.0,1,0.6,5,0.6428571428571429,14.0,0.4
4750,WANAMEI (Árbol de vida) Conservando los bosques de Amarakaeri,Peru,VM0048,REDD,276418,0.8333333333333334,6,0.6206896551724138,29,0.5337620578778135,311.0,0.29957127545551987
4743,Yvoty REDD+ Project: Forest Conservation in Eastern Paraguay,Paraguay,VM0007,REDD,478920,0.7142857142857143,7,0.6271186440677966,118,0.6720257234726688,311.0,0.0871670702179177
4739,Land Life Reforestation and Restoration of Degraded Land in Spain - B,Spain,AR-ACM0003,ARR,1990,1.0,3,0.08394160583941605,274,0.09660107334525939,559.0,0.916058394160584
4741,Land Life Reforestation and Restoration of Degraded Land in Spain - A,Spain,AR-AM0003,ARR,1169,1.0,1,0.25,4,0.06976744186046512,559.0,0.9302325581395349
4734,Tang River Improved Cropland Management Project,China,VM0042,ALM,394130,0.7391304347826086,69,0.6787330316742082,221,0.8365695792880259,618.0,0.1578365476138177
4732,"NatureRe assisted natural regeneration project in degraded lands in Antioquia, Colombia",Colombia,AR-ACM0003,ARR,37467,0.6923076923076923,13,0.4233576642335766,274,0.4561717352415027,559.0,0.26895002807411567
4729,Reforestation activities in Brazil for carbon removals from the atmosphere,Brazil,AR-ACM0003,ARR,4391,0.18181818181818182,22,0.1386861313868613,274,0.16100178890876565,559.0,0.04313205043132051
4730,Xinjiang Habahe Improved Grassland Management Project,China,VM0026,ALM,197077,0.2,40,0.2765957446808511,47,0.7411003236245954,618.0,0.5411003236245955
4727,Rabo Carbon Bank Trees for Farmers (TFF) Brazil ARR Grouped Project,Brazil,VM0047,ARR,70883,0.4375,16,0.47752808988764045,178,0.5813953488372093,559.0,0.14389534883720934
4724,Xinjiang Altay Improved Grassland Management Project,China,VM0026,ALM,757366,0.925,40,0.9361702127659575,47,0.9142394822006472,618.0,0.021930730565310252
4725,Livestock 2040/ Uruguay,Uruguay,VM0042,ALM,610,1.0,1,0.058823529411764705,221,0.021035598705501618,618.0,0.9789644012944984
4718,Hainan Baisha Improved Forest Management Project,China,VM0010,IFM,21770,0.10294117647058823,68,0.11764705882352941,102,0.23397435897435898,156.0,0.13103318250377075
4720,Reforestation of Lands for Multiple Purposes as a Sustainable Development Driver,Brazil,AR-ACM0003,ARR,5403,0.22727272727272727,22,0.14963503649635038,274,0.18783542039355994,559.0,0.07763769077637689
4714,Kajiado Rangelands Carbon Project,Kenya,VM0032,ALM,915139,0.6666666666666666,3,0.875,16,0.941747572815534,618.0,0.2750809061488674
4712,Permaculture initiative through community participation,"Congo, The Democratic Republic of The",AR-ACM0003,ARR,410738,1.0,2,0.8138686131386861,274,0.8622540250447227,559.0,0.18613138686131392
4713,Enhancing rural livelihoods of farmers through carbon finance,India,VM0047,ARR,113743,0.5675675675675675,37,0.601123595505618,178,0.6654740608228981,559.0,0.09790649325533052
4708,Tasar Forest Carbon Project,India,AR-ACM0003,ARR,43299,0.5535714285714286,56,0.4489051094890511,274,0.47942754919499103,559.0,0.1046663190823775
4709,Strengthening rural livelihood through carbon finance: Agroforestry practices in Gorakhpur Forest Circle of Uttar Pradesh,India,AR-AMS0007,ARR,36813,0.9230769230769231,13,0.8095238095238095,42,0.4543828264758497,559.0,0.4686940966010734
4704,Yecheng Grassland Sustainable Management Project (Phase 2),China,VM0026,ALM,316849,0.6,40,0.6382978723404256,47,0.8203883495145631,618.0,0.2203883495145631
4702,Chahar Right Rear Banner Improved Grassland Management Project,China,VM0026,ALM,375965,0.65,40,0.6808510638297872,47,0.8317152103559871,618.0,0.18171521035598703
4698,Hive Ecosystems project,South Africa,AR-ACM0003,ARR,33749,0.42857142857142855,7,0.3978102189781022,274,0.4347048300536673,559.0,0.036894611075565076
4699,Baviaanskloof Carbon Project,South Africa,AR-ACM0003,ARR,18268,0.14285714285714285,7,0.30656934306569344,274,0.3559928443649374,559.0,0.21313570150779454
4690,Ningxia Pengyang 2021-2023 Afforestation Project,China,AR-ACM0003,ARR,53294,0.19696969696969696,66,0.49635036496350365,274,0.5295169946332737,559.0,0.33254729766357677
4691,Shaanxi Ningshan IFM (convesion of logging to protected forest) Project,China,ACM0010,IFM,140594,1.0,1,1.0,1,0.6987179487179487,156.0,0.3012820512820513
4686,PUR - Agroforestry in coffee landscapes of Costa Rica,Costa Rica,AR-AMS0007,ARR,2110,1.0,1,0.30952380952380953,42,0.1073345259391771,559.0,0.8926654740608229
4687,Tueré REDD+ Project,Brazil,VM0015,REDD,862557,0.890625,64,0.7456140350877193,114,0.7652733118971061,311.0,0.14501096491228072
4689,Ateles REDD+,Brazil,VM0015,REDD,803046,0.875,64,0.7368421052631579,114,0.7556270096463023,311.0,0.13815789473684215
4681,YBYRÁ REDD+ Project,Brazil,VM0015,REDD,241612,0.671875,64,0.5350877192982456,114,0.4855305466237942,311.0,0.1863444533762058
4676,Knollwood Improved Forest Management Project,United States,VM0003,IFM,3814,0.14285714285714285,7,0.16666666666666666,18,0.0641025641025641,156.0,0.10256410256410256
4674,Selva Norte Conservation Project (CSN+),Peru,VM0015,REDD,1246187,1.0,9,0.8421052631578947,114,0.8360128617363344,311.0,0.16398713826366562
4668,Alxa Left Banner Improved Grassland Management Project,China,VM0026,ALM,301115,0.5,40,0.5531914893617021,47,0.8090614886731392,618.0,0.3090614886731392
4670,"SOIL CARBON MANAGEMENT FOR IMPROVED GRASSLAND: LIMPOPO-LIPADI, BOTSWANA",Botswana,VM0032,ALM,10000,1.0,1,0.125,16,0.063915857605178,618.0,0.936084142394822
4671,ANGELIM REDD+ Project,Brazil,VM0015,REDD,82582,0.375,64,0.30701754385964913,114,0.24758842443729903,311.0,0.12741157556270097
4660,Legacy Forest Climate Initiative,United States,VM0010,IFM,163000,1.0,1,0.6764705882352942,102,0.7243589743589743,156.0,0.32352941176470584
4659,One Mara Carbon Project,Kenya,VM0042,ALM,127717,0.42857142857142855,7,0.4298642533936652,221,0.6877022653721683,618.0,0.25913083680073973
4656,Guangdong Foshan Improved Forest Management Project,China,VM0010,IFM,1586,0.014705882352941176,68,0.029411764705882353,102,0.05128205128205128,156.0,0.0365761689291101
4658,Lavardin Improved Forest Management through the Extension of Rotation Age,Uruguay,VM0003,IFM,12679,1.0,1,0.3888888888888889,18,0.16025641025641027,156.0,0.8397435897435898
4655,Improved Grazing Management in Mosaic Forest - Grasslands Landscapes in the Centre-North of Argentina.,Argentina,VM0032,ALM,9726,1.0,1,0.0625,16,0.061488673139158574,618.0,0.9385113268608414
4652,The Revive Project,New Zealand,VM0047,ARR,10000,0.5,2,0.199438202247191,178,0.26028622540250446,559.0,0.300561797752809
4651,The New Zealand Indigenous Forest Regeneration Project,New Zealand,VM0012,IFM,10000,0.75,2,0.4166666666666667,18,0.13782051282051283,156.0,0.6121794871794872
4644,Scarcies Mangrove Rewilding Project,Sierra Leone,VM0033,ARR; WRC,78000,0.5,2,0.6136363636363636,44,0.5789473684210527,38.0,0.11363636363636365
4646,"TIST Program in Kenya, VCS-011",Kenya,AR-ACM0003,ARR,649750,1.0,3,0.8978102189781022,274,0.9159212880143113,559.0,0.1021897810218978
4633,Fortaleza Ituxi II REDD+,Brazil,VM0007,REDD,592928,0.6842105263157895,38,0.6694915254237288,118,0.7106109324758842,311.0,0.04111940705215544
4631,"Ambrosia Agroforestry System, Nagua, Dominican Republic ",Dominican Republic,VM0042,ARR,181,1.0,1,0.01809954751131222,221,0.026833631484794274,559.0,0.9819004524886877
4632,"Cuango Farm, Afforestation Colon, Panama",Panama,ACM0003,ARR,2987,1.0,1,0.25,4,0.1252236135957066,559.0,0.8747763864042934
4629,Lishu Blackland Conservation Project in Jilin Province,China,VM0042,ALM,55509,0.057971014492753624,69,0.26244343891402716,221,0.2168284789644013,618.0,0.20447242442127353
4630,AGROFORESTRY PLANTATIONS TO ENHANCE THE LIVELIHOOD OF RURAL COMMUNITIES IN INDIA,India,AR-AMS0007,ARR,8361,0.5384615384615384,13,0.6190476190476191,42,0.24329159212880144,559.0,0.3757560269188176
4626,Regeneration Meghalaya,India,AR-ACM0003,ARR,310289,0.8571428571428571,56,0.7518248175182481,274,0.817531305903399,559.0,0.10531803962460895
4627,"Trees for Livelihood in Madhya Pradesh, India",India,AR-ACM0003,ARR,3864,0.07142857142857142,56,0.12043795620437957,274,0.13953488372093023,559.0,0.0681063122923588
4623,REDD+ Mwali Project,Comoros,VM0015,REDD,22061,1.0,1,0.09649122807017543,114,0.07717041800643087,311.0,0.9228295819935691
4621,Shandong Ju County ALM Project,China,VM0042,ALM,134210,0.391304347826087,69,0.4434389140271493,221,0.6925566343042071,618.0,0.30125228647812013
4617,"Kwango River Project, Democratic Republic of Congo","Congo, The Democratic Republic of The",AR-ACM0003,ARR,166669,0.5,2,0.6715328467153284,274,0.7352415026833632,559.0,0.2352415026833632
4619,Ñangareko Forest Reserve,Paraguay,VM0007,REDD,78500,0.42857142857142855,7,0.2033898305084746,118,0.2379421221864952,311.0,0.22518159806295396
4615,PANÃMA REDD+ PROJECT,Brazil,VM0048,REDD,179803,0.45454545454545453,11,0.4482758620689655,29,0.38263665594855306,311.0,0.07190879859690147
4609,Hainan Jinhua IFM(Coversion of logged to protected forest)  Project,China,VM0010,IFM,82881,0.6470588235294118,68,0.5196078431372549,102,0.5576923076923077,156.0,0.12745098039215685
4613,ENHANCING INCOME FOR SMALLHOLDER FARMERS THROUGH HORTICULTURE-BASED CULTIVATION IN THE WESTERN REGION OF INDIA,India,AR-ACM0003,ARR,7642,0.14285714285714285,56,0.18248175182481752,274,0.23434704830053668,559.0,0.09148990544339383
4606,Qinghai Gangcha Improved Grassland Management Project,China,VM0026,ALM,125862,0.125,40,0.2127659574468085,47,0.6844660194174758,618.0,0.5594660194174758
4607,KOSHER BLUE CARBON -1,India,VM0033,ARR,82879,1.0,3,0.6590909090909091,44,0.6046511627906976,559.0,0.39534883720930236
4602,"REDD Carbon and Biodiversity Project, Greater El Rey Area, Jujuy, Argentina",Argentina,VM0009,REDD,85240,1.0,1,0.10344827586206896,29,0.2508038585209003,311.0,0.896551724137931
4598,Enhancing Livelihoods of Farmers in Gujarat through Agroforestry Plantations by SHBVM,India,AR-AMS0007,ARR,6465,0.46153846153846156,13,0.5,42,0.20930232558139536,559.0,0.2906976744186046
4596,Carbon Emission Reduction Project through Improved Water Management in Bio-farming,Japan,VM0042,ALM,5205,1.0,1,0.10407239819004525,221,0.043689320388349516,618.0,0.9563106796116505
4591,PIEMONTE BAMBOO,Italy,AR-ACM0003,ARR,1974411,1.0,3,0.9890510948905109,274,0.9821109123434705,559.0,0.017889087656529523
4592,Symbiosis Continuous Cover Forest Project,Brazil,AR-ACM0003,ARR,687480,0.8636363636363636,22,0.9051094890510949,274,0.9212880143112702,559.0,0.05765165067490652
4587,Boreal Wildlands Forest Carbon Offset Project,Canada,VM0034,IFM,179566,0.9090909090909091,11,0.9166666666666666,12,0.7371794871794872,156.0,0.1794871794871794
4579,REGENERATIVE AGRICULTURE AND CARBON PROJECT IN SPAIN,Spain,VM0042,ALM,10060,0.5,2,0.14027149321266968,221,0.06634304207119741,618.0,0.4336569579288026
4574,MAHARASHTRA AND GUJARAT INITIATIVE FOR REGENERATIVE AGRICULTURE AND INCOME CREATION,India,VM0042,ALM,369451,0.7777777777777778,27,0.669683257918552,221,0.8300970873786407,618.0,0.16041382946008875
4577,GROUPED ARR PROJECT IN TELANGANA,India,AR-ACM0003,ARR,35794,0.5178571428571429,56,0.40875912408759124,274,0.4418604651162791,559.0,0.10909801876955166
4563,ALLCOT BLUE CARBON MANGROVE PROJECT IN SENEGAL (ABC  Mangrove Senegal),Senegal,VM0033,WRC,71548,1.0,1,0.5909090909090909,44,0.6666666666666666,9.0,0.40909090909090906
4561,Shandong Zhucheng ALM Project,China,VM0042,ALM,173573,0.5507246376811594,69,0.5248868778280543,221,0.7249190938511327,618.0,0.2000322160230784
4557,Strengthening rural livelihood through carbon finance: Agroforestry practices in Bareilly Forest Circle of Uttar Pradesh,India,AR-AMS0007,ARR,18382,0.7692307692307693,13,0.7380952380952381,42,0.3595706618962433,559.0,0.40966010733452596
4551,Hubei Badong IFM PROJECT,China,VM0010,IFM,27123,0.16176470588235295,68,0.1568627450980392,102,0.28205128205128205,156.0,0.12518853695324283
4552,UÁKIRY REDD+ AUDD  GROUPED PROJECT,Brazil,VM0015,REDD,147028,0.546875,64,0.43859649122807015,114,0.3536977491961415,311.0,0.1931772508038585
4545,Sodom Hanba Improved Grassland Management Project,China,VM0026,ALM,408247,0.7,40,0.723404255319149,47,0.8414239482200647,618.0,0.14142394822006477
4543,Leconi Agroforestry Project in Haut-Ogooue (LAPHO),Gabon ,AR-ACM0003,ARR,1054763,1.0,1,0.948905109489051,274,0.9516994633273703,559.0,0.051094890510948954
4542,Amazônidas REDD+ AUDD Grouped Project,Brazil,VM0015,REDD,258235,0.71875,64,0.5701754385964912,114,0.5241157556270096,311.0,0.19463424437299037
4539,Community-Based Mangrove Conservation and Restoration in Sierra Leone,Sierra Leone,VM0033,ARR; REDD; WRC,258000,1.0,1,0.8636363636363636,44,0.25,12.0,0.75
4540,THE NAGALAND 4 CHANGE REDD+ PROJECT,India,VM0007,REDD,200000,0.5,2,0.3813559322033898,118,0.40836012861736337,311.0,0.11864406779661019
4541,SUNDARI MANGROVE RESTORATION PROJECT IN THE INDIAN SUNDARBANS,India,VM0033,ARR; WRC,8497,0.2,5,0.18181818181818182,44,0.07894736842105263,38.0,0.12105263157894738
4536,REDD+ Esteros y Manglares,Colombia,VM0007,REDD; WRC,44167,0.5,2,0.1271186440677966,118,0.17647058823529413,17.0,0.3728813559322034
4532,INTELLIGENT AGRICULTURE OF THE MEDITERRANEAN,Italy,AR-ACM0003; VM0042,ALM,170419,1.0,1,1.0,1,0.7200647249190939,618.0,0.2799352750809061
4525,The Republic of the Congo Improved Forest Management Project,Congo,VM0010,IFM,2657020,1.0,2,1.0,102,1.0,156.0,0.0
4527,basilicata bamboo,Italy,AR-AMS0007,ALM,206737,1.0,1,0.9285714285714286,42,0.7508090614886731,618.0,0.2491909385113269
4528,Sichuan Lizhou Improved Forest Management Project,China,VM0010,IFM,37757,0.3235294117647059,68,0.2647058823529412,102,0.36538461538461536,156.0,0.10067873303167418
4529,Shaanxi Fengxian Improved Forest Management Project,China,VM0010,IFM,27812,0.19117647058823528,68,0.17647058823529413,102,0.2948717948717949,156.0,0.11840120663650075
4520,Muara Teweh Conservation Project,Indonesia,VM0010,IFM,756925,0.6,5,0.9705882352941176,102,0.967948717948718,156.0,0.37058823529411766
4518,Qitai Shuifa Improved Grassland Management Project,China,VM0026,ALM,180008,0.175,40,0.2553191489361702,47,0.7346278317152104,618.0,0.5596278317152104
4516,Dongzong Sustainable Grassland Management Project,China,VM0026,ALM,498372,0.8,40,0.8297872340425532,47,0.8624595469255664,618.0,0.06245954692556632
4513,Argentina Gran Chaco Region REDD+ Project,Argentina,VM0007,REDD,33035,1.0,1,0.0847457627118644,118,0.10610932475884244,311.0,0.9152542372881356
4500,Improved cropland management project in Fan,China,VM0042,ALM,74250,0.10144927536231885,69,0.29411764705882354,221,0.6213592233009708,618.0,0.519909947938652
4501,Improved cropland management project in Qingfeng,China,VM0042,ALM,112500,0.2608695652173913,69,0.39819004524886875,221,0.6715210355987055,618.0,0.41065147038131417
4502,Improved cropland management project in Jiaoqu,China,VM0042,ALM,156240,0.5072463768115942,69,0.4841628959276018,221,0.7071197411003236,618.0,0.2229568451727218
4503,Improved cropland management project in Zhaozhou,China,VM0042,ALM,450000,0.7536231884057971,69,0.6968325791855203,221,0.8495145631067961,618.0,0.15268198392127574
4504,Improved cropland management project in Keyouqianqi,China,VM0042,ALM,598500,0.8115942028985508,69,0.7601809954751131,221,0.8851132686084142,618.0,0.12493227313330113
4505,Improved cropland management project in Hengshan,China,VM0042,ALM,119925,0.30434782608695654,69,0.4117647058823529,221,0.6779935275080906,618.0,0.37364570142113407
4506,Improved cropland management project in Yuli,China,VM0042,ALM,155925,0.4927536231884058,69,0.4796380090497738,221,0.7055016181229773,618.0,0.22586360907320352
4507,Improved cropland management project in Zhaoyuan,China,VM0042,ALM,299250,0.6811594202898551,69,0.6425339366515838,221,0.8074433656957929,618.0,0.16490942904420913
4509,Brazil Pastureland Regeneration with Native Palm Silvopasture,Brazil,VM0047,ARR,42396,0.125,16,0.33707865168539325,178,0.47227191413237923,559.0,0.34727191413237923
4511,Silvador Climate Action,Romania,VM0012,IFM,11096,0.5,4,0.5,18,0.14743589743589744,156.0,0.35256410256410253
4495,"Working Trees supporting eastern US Silvopasture, Project 1",United States,Methodology Under Development,ARR,1000000,1.0,1,0.8888888888888888,9,0.9481216457960644,559.0,0.11111111111111116
4497,Amazon Partners 20,Brazil,VM0015,REDD,173023,0.578125,64,0.45614035087719296,114,0.37942122186495175,311.0,0.19870377813504825
4490,Maodeng Pasture Improved Grassland Management Project,China,VM0026,ALM,43808,0.075,40,0.14893617021276595,47,0.13106796116504854,618.0,0.07393617021276595
4488,Agroforestry For Livelihoods,Rwanda,AR-ACM0003,ARR,114090,1.0,2,0.6167883211678832,274,0.669051878354204,559.0,0.3832116788321168
4489,RIWNE OBLAST FOREST PRESERVATION PROJECT (Conversion of logged to protected forest),Ukraine,VM0010,IFM,297696,1.0,1,0.8137254901960784,102,0.8397435897435898,156.0,0.18627450980392157
4483,Inner Mongolia Hinggan League Improved Grassland Management Project,China,VM0026,ALM,27615,0.025,40,0.0851063829787234,47,0.10194174757281553,618.0,0.07694174757281552
4485,Mejuruá Project,Brazil,VM0007,REDD,2677281,0.9473684210526315,38,0.9322033898305084,118,0.9196141479099679,311.0,0.027754273142663655
4481,Restore Africa: Restoring trees and livelihoods in Kenya,Kenya,Methodology Under Development,ARR,44788,1.0,1,0.3333333333333333,9,0.4847942754919499,559.0,0.6666666666666667
4480,REDD++ Manglares del Bajo Baudo,Colombia,VM0007,REDD; WRC,127026,1.0,2,0.3050847457627119,118,0.4117647058823529,17.0,0.6949152542372881
4476,Grouped Project Sapucaia Sustainable Forests,Brazil,Methodology Under Development,ARR,174095,1.0,1,0.5555555555555556,9,0.7441860465116279,559.0,0.4444444444444444
4473,Karidja forest restoration project,Cote D'Ivoire,Methodology Under Development,ARR,878000,1.0,1,0.7777777777777778,9,0.9391771019677997,559.0,0.2222222222222222
4474,Santa Nicolasa North Patagonia Regenerative Grazing Project,Argentina,VM0026,ALM,71123,1.0,2,0.1702127659574468,47,0.616504854368932,618.0,0.8297872340425532
4475,Kijani Forestry smallholder farmer forestry project,Uganda,AR-ACM0003,ARR,316293,0.8333333333333334,6,0.7627737226277372,274,0.8228980322003577,559.0,0.07055961070559613
4462,Forestal RioAquidaban (FRA),Paraguay,AR-AMS0007,ARR,4500,0.5,2,0.38095238095238093,42,0.16547406082289803,559.0,0.33452593917710194
4463,Land Life Reforestation and Restoration on Degraded Land in Australia,Australia,AR-ACM0003,ARR,4500,0.6666666666666666,3,0.145985401459854,274,0.16547406082289803,559.0,0.5206812652068127
4455,XINJIANG MAKIT COUNTY WINDBREAK AND SAND FIXATION ECOLOGICAL FOREST CONSTRUCTION BASE PROJECT,China,AR-ACM0003,ARR; IFM,239836,0.5,2,0.7299270072992701,274,0.75,8.0,0.25
4456,CREATING LIVELIHOOD OPPORTUNITIES AND CARBON CREDIT INCOME FOR SMALLHOLDER FARMERS THROUGH HORTICULTURAL PLANTATIONS IN BANGLADESH,Bangladesh,AR-ACM0003,ARR,567407,1.0,1,0.8759124087591241,274,0.9087656529516994,559.0,0.12408759124087587
4458,DEVELOPING CARBON PROJECT FOR FARMERS ADOPTING REGENERATIVE AGRICULTURAL PRACTICES IN GUJARAT STATE,India,VM0042,ALM,57329,0.4444444444444444,27,0.27149321266968324,221,0.2815533980582524,618.0,0.17295123177476118
4459,Developing Climate Resilience Of The Residential Society In Hyderabad Through Miyawaki Afforestation: Urban Forest Development,India,VM0047,ARR,580,0.05405405405405406,37,0.03932584269662921,178,0.05366726296958855,559.0,0.014728211357424845
4460,"GreenShift: Catalyzing regenerative agriculture ecosystem for smallholder farmers in India, through carbon finance",India,VM0042,ALM,4505732,0.9259259259259259,27,0.9819004524886877,221,0.9919093851132686,618.0,0.06598345918734272
4461,REDD+ Tauari Forest Conservation Project,Brazil,VM0007,REDD,3933759,0.9736842105263158,38,0.9661016949152542,118,0.9678456591639871,311.0,0.007582515611061602
4453,Regenerate Outcomes Farming Project,United Kingdom,VM0042,ALM,466,0.5,2,0.04524886877828054,221,0.016181229773462782,618.0,0.48381877022653724
4451,Ejin Banner Improved Grassland Management Project,China,VM0026,ALM,561083,0.85,40,0.8723404255319149,47,0.8770226537216829,618.0,0.027022653721682888
4452,Asaga Amazonas REDD+ project,Brazil,VM0015,REDD,3037472,1.0,64,0.9385964912280702,114,0.9389067524115756,311.0,0.06140350877192979
4449,The High Impact carbon farming program of Bulgaria,Bulgaria,VM0042,ALM,76200,0.5,2,0.3076923076923077,221,0.627831715210356,618.0,0.32013940751804826
4450,ORDOS CITY AFFORESTATION PROJECT IN INNER MONGOLIA AUTONOMOUS REGION,China,AR-ACM0003,ARR,6801,0.045454545454545456,66,0.17518248175182483,274,0.21645796064400716,559.0,0.17100341518946172
4448,Raízes do Bem Grouped ARR Project,Brazil,AR-AMS0007,ARR,204,0.2,5,0.09523809523809523,42,0.028622540250447227,559.0,0.1713774597495528
4446,Yuli Grassland Sustainable Management Project,China,VM0026,ALM,175314,0.15,40,0.23404255319148937,47,0.7265372168284789,618.0,0.5765372168284789
4439,Yecheng Grassland Sustainable Management Project (Phase 1),China,VM0026,ALM,270260,0.375,40,0.44680851063829785,47,0.7831715210355987,618.0,0.40817152103559873
4436,RESTORATION OF DEGRADED LAND TO ENHANCE TREE COVER AND IMPROVE LIVELIHOODS OF FARMERS IN INDIA,India,AR-ACM0003,ARR,3726,0.05357142857142857,56,0.11496350364963503,274,0.1368515205724508,559.0,0.08328009200102224
4435,Cobram Estate Olives Regenerative Farming Project,Australia,VM0042,ALM,55722,0.25,4,0.2669683257918552,221,0.22330097087378642,618.0,0.04366735491806878
4429,Management of Community Forests for the Reduction of Deforestation in the Peruvian Amazon,Peru,VM0015,REDD,1039475,0.8888888888888888,9,0.7982456140350878,114,0.8070739549839229,311.0,0.09064327485380108
4430,Reflorestamento de Impacto no Brasil Project,Brazil,AR-ACM0003,ARR,239,0.045454545454545456,22,0.040145985401459854,274,0.03220035778175313,559.0,0.013254187672792322
4424,Sichuan Muli County REDD Project,China,VM0007,REDD,234910,0.75,2,0.4194915254237288,118,0.454983922829582,311.0,0.3305084745762712
4422,Inner Mongolia Kuduer Improved Forest Management Project.,China,VM0010,IFM,101933,0.7352941176470589,68,0.5784313725490197,102,0.6089743589743589,156.0,0.1568627450980392
4418,The chestnut groves of Calabria and Campania,Italy,VM0026; AR-ACM0003; VM0042,ALM,94208,1.0,1,1.0,1,0.6456310679611651,618.0,0.3543689320388349
4419,Project MATANI REDD+ DIOS MAYOR DE LOS PUEBLOS CABILLARI CONSERVACION ANCESTRAL,Colombia,VM0015,REDD,1067300,0.8846153846153846,13,0.8201754385964912,114,0.8183279742765274,311.0,0.06628741033885721
4408,Lake Victoria Watershed Agroforestry Carbon Project,Kenya,VM0042,ALM,530328,0.7142857142857143,7,0.7375565610859729,221,0.8689320388349514,618.0,0.1546463245492371
4411,Xinzhou Echeng Afforestation Project,China,AR-ACM0003,ARR,332773,0.5757575757575758,66,0.7737226277372263,274,0.8318425760286225,559.0,0.25608500027104675
4397,Jilin Zhenlai Improved Agricultural Land Management Project,China,VM0042,ALM,107094,0.2318840579710145,69,0.38009049773755654,221,0.6601941747572816,618.0,0.42831011678626707
4398,Jilin Dehui Improved Crop Management Project,China,VM0042,ALM,149989,0.43478260869565216,69,0.46153846153846156,221,0.6990291262135923,618.0,0.2642465175179401
4399,Heilongjiang Shuangcheng Improved Agricultural Land Management Project,China,VM0042,ALM,723139,0.855072463768116,69,0.8144796380090498,221,0.9077669902912622,618.0,0.09328735228221241
4400,Improved Cropland Management Project in Morin Dawa,China,VM0042,ALM,1015078,0.9420289855072463,69,0.8778280542986425,221,0.9466019417475728,618.0,0.06877388744893032
4401,Hunan Miluo IFM (conversion of logged to protected forest) Project,China,VM0010,IFM,23621,0.1323529411764706,68,0.13725490196078433,102,0.2564102564102564,156.0,0.1240573152337858
4392,Jinhui sustainable grassland management project,China,VM0026,ALM,789206,0.95,40,0.9574468085106383,47,0.9207119741100324,618.0,0.03673483440060599
4394,Jatobá REDD+ Project,Brazil,VM0007,REDD,187491,0.34210526315789475,38,0.3559322033898305,118,0.3858520900321543,311.0,0.04374682687425957
4387,REDD+ Project Pacha Prometida,Bolivia,VM0007,REDD,367619,1.0,3,0.5423728813559322,118,0.6109324758842444,311.0,0.4576271186440678
4388,Jiangsu Jiangyan Improved Agricultural Land Management Project,China,VM0042,ALM,96210,0.17391304347826086,69,0.34841628959276016,221,0.6472491909385113,618.0,0.47333614746025043
4390,Jiangsu Guanyun Improved Agricultural Land Management Project,China,VM0042,ALM,315778,0.6956521739130435,69,0.6515837104072398,221,0.8187702265372169,618.0,0.16718651612997704
4391,Amazon Partners 1,Brazil,VM0015,REDD,137115,0.5,64,0.41228070175438597,114,0.3408360128617363,311.0,0.15916398713826369
4384,Jaji ARR Project,Nigeria,AR-AMS0007,ARR,4800,1.0,1,0.40476190476190477,42,0.16994633273703041,559.0,0.8300536672629696
4377,Guangdong Huaiji County IFM (conversion of logged to protected forest) Project,China,VM0010,IFM,107124,0.7647058823529411,68,0.5980392156862745,102,0.6217948717948718,156.0,0.16666666666666663
4379,Huinan County Improved Cropland Management Project,China,VM0042,ALM,61596,0.07246376811594203,69,0.28054298642533937,221,0.6084142394822006,618.0,0.5359504713662586
4381,WEST SERAM REDD+ and AGARWOOD ForestWise PROJECT,Indonesia,VM0047,ARR,1005710,0.8,5,0.9325842696629213,178,0.9499105545617174,559.0,0.1499105545617173
