resourceIdentifier,resourceName,country,protocols,protocolSubCategories,estAnnualEmissionReductions,M4_tight,n_tight,M4_methodology,n_methodology,M4_subcat,n_subcat,M4_range
6003,Arona 1,Uruguay,VM0047,ARR,29442,1.0,2,0.30337078651685395,178,0.41323792486583183,559.0,0.696629213483146
5992,"ATMANIRBHAR KRISHAK PLANTATION PROJECT (KHARGONE, M.P.)",India,VM0047,ARR,339097,0.8918918918918919,37,0.8258426966292135,178,0.8372093023255814,559.0,0.06604919526267838
5990,"ATMANIRBHAR KRISHAK PLANTATION PROJECT (KHANDWA, M.P.)",India,VM0047,ARR,354025,0.918918918918919,37,0.8370786516853933,178,0.8479427549194991,559.0,0.08184026723352567
5985,Topraq Carbon Management Project in Northern Kazakhstan,Kazakhstan,VM0042,ALM,38000,0.2,5,0.2171945701357466,221,0.11974110032362459,618.0,0.09745346981212202
5976,Venture Carbon Tropical Agricultural Soil Carbon Removal Project in Brazil,Brazil,VM0042,ALM,696686,0.4,15,0.7963800904977375,221,0.901294498381877,618.0,0.501294498381877
5957,KENYA HIGHLANDS GROUPED CARBON PROJECT,Kenya,VM0042,ALM,191805,0.5714285714285714,7,0.5429864253393665,221,0.7378640776699029,618.0,0.19487765233053644
5956,AgriCapture Southeast Asia Rice Methane Project,Indonesia,VM0051,ALM,53142,1.0,1,0.375,8,0.17718446601941748,618.0,0.8228155339805825
5953,MARCONDES REDD+,Brazil,VM0007,REDD,250213,0.4473684210526316,38,0.4661016949152542,118,0.5080385852090032,311.0,0.060670164156371664
5949,Gran Pajonal REDD+ and Agroforestry Project,Peru,VM0048,REDD,129252,0.5,6,0.3448275862068966,29,0.33440514469453375,311.0,0.16559485530546625
5939,ALGARROBAL,Argentina,VM0047,ARR,43000,0.6153846153846154,13,0.34831460674157305,178,0.4776386404293381,559.0,0.26707000864304237
5932,THAILAND CARBON PROGRAM OF IMPROVED AGRICULTURAL LAND MANAGEMENT IN THE AREAS OF THE NORTHEAST PROJECT,Thailand,VM0042,ALM,176000,1.0,1,0.5294117647058824,221,0.7281553398058253,618.0,0.47058823529411764
5929,Agricentric Carbon Initiative,Kenya,VM0042,ALM,75000,0.2857142857142857,7,0.2986425339366516,221,0.6245954692556634,618.0,0.33888118354137775
5924,"CARBON CONSERVANCY – FARMS WEST OF MUSINA (PLOT 1: LIMPOPO SAFARIS), SOUTH AFRICA",South Africa,VM0006,REDD,7667,1.0,1,0.05,20,0.04501607717041801,311.0,0.954983922829582
5922,Lamantin - Community-based mangrove conservation and restoration in Guinea,Guinea,VM0007; VM0033,REDD; WRC,80000,0.5,2,0.3333333333333333,3,0.29411764705882354,17.0,0.20588235294117646
5923,Balbuzard - Community-based mangrove conservation and restoration in Guinea,Guinea,VM0007; VM0033,REDD; WRC,118000,1.0,2,0.6666666666666666,3,0.35294117647058826,17.0,0.6470588235294117
5918,Family Forest Carbon Program - Fields & Forests,United States,VM0047,ARR,21922,0.4,5,0.28651685393258425,178,0.3756708407871199,559.0,0.11348314606741577
5919,Family Forest Carbon Program - North,United States,VM0045,IFM,100000,0.6666666666666666,3,0.5714285714285714,7,0.5961538461538461,156.0,0.09523809523809523
5907,Future Ecology Improved Agricultural Land Management Project,Kazakhstan,VM0042,ALM,249597,0.4,5,0.6018099547511312,221,0.7686084142394822,618.0,0.3686084142394822
5904,Future Ecology Soil Organic Carbon Enhancement Project,Kazakhstan,VM0042,ALM,570592,0.6,5,0.755656108597285,221,0.8802588996763754,618.0,0.2802588996763754
5905,Gunung Mas Community Forest Restoration Project,Indonesia,VM0047,ARR,445244,0.6,5,0.8539325842696629,178,0.8676207513416816,559.0,0.2676207513416816
5906,Arbonics Afforestation Project Five,United Kingdom,VM0047,ARR,2000,0.5,2,0.08426966292134831,178,0.1001788908765653,559.0,0.4157303370786517
5901,"PROJECT URAMIA – COMMUNITY-LED FOREST CONSERVATION REDD+ PROJECT IN CHOCÓ, COLOMBIA",Colombia,VM0048,REDD,1338705,1.0,1,0.9310344827586207,29,0.8520900321543409,311.0,0.14790996784565913
5897,HARIT BHARAT - TELANGANA,India,VM0047,ARR,1892926,1.0,37,0.9606741573033708,178,0.9785330948121646,559.0,0.0393258426966292
5896,Project Sierra Verde,Philippines,VM0047,ARR,64788,0.5,6,0.4606741573033708,178,0.5670840787119857,559.0,0.10640992140861494
5895,BigCoast Forest Climate Initiative Haida Gwaii,Canada,VM0012,IFM,49688,0.5,6,0.7222222222222222,18,0.42948717948717946,156.0,0.29273504273504275
5891,Forest Landscape Restoration in North Sulawesi Province,Indonesia,VM0047,ARR,158764,0.4,5,0.6573033707865169,178,0.7209302325581395,559.0,0.32093023255813946
5888,Developing Voluntary Carbon Market Projects for Tree Plantations in the State of Assam,India,VM0047,ARR,54765,0.40540540540540543,37,0.42134831460674155,178,0.5366726296958855,559.0,0.13126722429048004
5889,Cabeceira do Xingu REDD Project,Brazil,VM0048,REDD,55041,0.18181818181818182,11,0.13793103448275862,29,0.17363344051446947,311.0,0.043887147335423204
5890,AgriCapture South Asia Rice Methane Project,India,VM0051,ALM,566547,1.0,2,0.875,8,0.8786407766990292,618.0,0.125
5879,Amazon Forest Landscape Restoration - Outgrowers Component,Peru,VM0047,ARR,5115,0.3333333333333333,3,0.15168539325842698,178,0.18246869409660108,559.0,0.18164794007490634
5874,East Coast Mangroves – Restoration Project in Sri Lanka,Sri Lanka,VM0033,WRC,97963,1.0,1,0.6818181818181818,44,0.7777777777777778,9.0,0.31818181818181823
5876,Kablaki Agroforestry for Small Farmers Program,Timor-Leste,VM0047,ARR,72103,1.0,1,0.48314606741573035,178,0.5831842576028623,559.0,0.5168539325842696
5877,Sierra Leone PRIDO ARR-Agroforestry Program,Sierra Leone,VM0047,ARR,80003,0.6666666666666666,3,0.5056179775280899,178,0.5992844364937389,559.0,0.16104868913857673
5873,Gunung Lumut Landscape Project,Indonesia,VM0007; VM0010; VM0048,ARR; IFM; REDD,941061,1.0,1,1.0,1,1.0,7.0,0.0
5872,Project Aranyam: Building Climate Resilient Communities in Maharashtra and Gujarat Through Agroforestry Practices,India,VM0047,ARR,297033,0.8108108108108109,37,0.7865168539325843,178,0.8103756708407871,559.0,0.024293956878226552
5862,Tubura Forest Landscape Restoration Program,Rwanda,VM0047,ARR,105000,1.0,1,0.5730337078651685,178,0.6547406082289803,559.0,0.4269662921348315
5863,One Acre Fund Munda Otsogola Program,Malawi,VM0047,ARR,92059,0.5,4,0.5337078651685393,178,0.627906976744186,559.0,0.12790697674418605
5858,Increasing Carbon Stocks through the Reforestation of the Communal Forests of Ndélélé and Bétaré-Oya,Cameroon,VM0047,ARR,73569,0.5,2,0.4887640449438202,178,0.5849731663685152,559.0,0.09620912142469495
5859,AgriCapture Latin America Rice Methane Project,Brazil,VM0051,ALM,46461,1.0,1,0.25,8,0.1423948220064725,618.0,0.8576051779935275
5853,Project Duiker | Forest Ecosystem Restoration in Eastern Guinea,Guinea,VM0047,ARR,109068,1.0,2,0.5786516853932584,178,0.6583184257602862,559.0,0.4213483146067416
5848,Lunga Luswishi Carbon Enhancement Project,Zambia,Methodology Under Development,ALM,18810,1.0,1,0.1111111111111111,9,0.08090614886731391,618.0,0.919093851132686
5845,Nunukan Mangrove & Peatland Project,Indonesia,VM0007; VM0033; VM0047,ARR; REDD; WRC,355275,1.0,1,1.0,1,0.5,12.0,0.5
5842,UNITÁN II: Afforestation and Reforestation Project with Variety of Native Species in the Argentine Chaco,Argentina,VM0047,ARR,1542,0.07692307692307693,13,0.07303370786516854,178,0.08407871198568873,559.0,0.011045004120520188
5837,Amazon Highest-Deforestation Frontline (HDF) XARR Grouped Project,Brazil,VM0047,ARR,300000,0.875,16,0.7949438202247191,178,0.8130590339892666,559.0,0.0800561797752809
5838,RIO BRANCO REDD+,Brazil,VM0048,REDD,60988,0.2727272727272727,11,0.1724137931034483,29,0.18971061093247588,311.0,0.10031347962382442
5836,Amazon Highest-Deforestation Frontline (HDF) XREDD Grouped Project,Brazil,VM0048,REDD,300000,0.7272727272727273,11,0.6724137931034483,29,0.5530546623794212,311.0,0.17421806489330605
5834,Delta Kapuas Project,Indonesia,VM0007; VM0033; VM0047; VM0048,ARR; REDD; WRC,2438716,1.0,1,1.0,1,1.0,12.0,0.0
5832,ZORÓ PANGYJEJ REDD+,Brazil,VM0048,REDD,241477,0.5454545454545454,11,0.5517241379310345,29,0.48231511254019294,311.0,0.06940902539084154
5831,IGARAPÉ LOURDES REDD+ PROJECT,Brazil,VM0048,REDD,52416,0.09090909090909091,11,0.10344827586206896,29,0.1607717041800643,311.0,0.0698626132709734
5821,"TREES FOR FARMERS, AGROFORESTRY PROJECT IN INDIA",India,VM0047,ARR,980163,0.972972972972973,37,0.9269662921348315,178,0.9463327370304114,559.0,0.04600668083814152
5823,Forêts d'Avenir,Senegal,VM0047,ARR,20443,0.5,2,0.2752808988764045,178,0.3685152057245081,559.0,0.2247191011235955
5820,The Gamboma and Mbon Afforestation Project,Congo,VM0047,ARR,2757662,1.0,2,0.9775280898876404,178,0.9874776386404294,559.0,0.022471910112359605
5818,Avé Ga Grouped Project,Togo,VM0047,ARR,174039,0.5,2,0.6910112359550562,178,0.7423971377459749,559.0,0.24239713774597493
5816,The Massangui Forest Conservation and Afforestation Project,Congo,VM0047; VM0048,ARR; REDD,383479,1.0,1,0.8,5,0.7142857142857143,14.0,0.2857142857142857
5813,"Developing a Voluntary Carbon Market Project with FPOs for Agroforestry Plantation in Saharanpur District of Uttar Pradesh, India",India,VM0047,ARR,54161,0.3783783783783784,37,0.4101123595505618,178,0.5330948121645797,559.0,0.15471643378620126
5814,THAILAND CARBON PROGRAM OF RICE-FIELD FOR ALTERNATIVE WET AND DRY IN THE AREAS OF THE CENTRAL AND NORTHERN,Thailand,VM0051,ALM,54645,1.0,1,0.5,8,0.20388349514563106,618.0,0.7961165048543689
5807,REGENERATIVE AGRICULTURE CARBON OFFSETTING (RACO) GROUP PROJECT,Malaysia,VM0042,ALM,13387,1.0,1,0.1493212669683258,221,0.06957928802588997,618.0,0.93042071197411
5805,Mangrove Mitra: Community-Led Coastal Resilience,India,VM0033,ARR; WRC,50553,0.6,5,0.45454545454545453,44,0.4473684210526316,38.0,0.1526315789473684
5806,Tausi Tanzania,Tanzania,VM0047,ARR,266196,0.75,4,0.7640449438202247,178,0.7960644007155635,559.0,0.0460644007155635
5802,Suledo Community ARR Project (Mradi wa jamii wa Suledo wa Hewa kaboni),Tanzania,VM0047,ARR,62406,0.25,4,0.4438202247191011,178,0.556350626118068,559.0,0.30635062611806796
5803,Improved Agricultural Land Management in Sierra Leone,Sierra Leone,VM0042,ALM,45000,1.0,1,0.23076923076923078,221,0.1343042071197411,618.0,0.8656957928802589
5798,KALTIM HUTAMA IFM PROJECT,Indonesia,VM0010,IFM,517003,0.4,5,0.9019607843137255,102,0.9102564102564102,156.0,0.5102564102564102
5799,Gerbang Barito REDD+ Project,Indonesia,VM0007,REDD; WRC,275000,0.125,8,0.4915254237288136,118,0.47058823529411764,17.0,0.3665254237288136
5796,Tanimbar Community Forest Restoration Project,Indonesia,VM0047,ARR,2568258,1.0,5,0.9719101123595506,178,0.9856887298747764,559.0,0.028089887640449396
5792,Togo Green Renaissance With Farmers and Schools,Togo,VM0047,ARR,696750,1.0,2,0.9044943820224719,178,0.9230769230769231,559.0,0.0955056179775281
5786,MYANMAR CARBON PROGRAM OF RICE-FIELD FOR GREENHOUSE GAS REDUCTION IN AREAS OF THE CENTRAL AND NORTHERN,Myanmar,VM0051,ALM,59738,1.0,1,0.625,8,0.4935275080906149,618.0,0.506472491909385
5783,Green Gold Loreto 2,Peru,VM0010,IFM,203181,0.2,5,0.7058823529411765,102,0.75,156.0,0.55
5779,The Ecopreneur Movement – Miombo Woodland Restoration Project,Zambia,VM0047,ARR,1432208,1.0,1,0.949438202247191,178,0.962432915921288,559.0,0.050561797752809
5780,KA’AGUY+ – Grouped REDD+ Project for Avoided Forest Degradation in Paraguay,Paraguay,VM0006,REDD,235000,1.0,1,0.35,20,0.45980707395498394,311.0,0.65
5774,ReTerra Brazil,Brazil,VM0042,ALM,717000,0.4666666666666667,15,0.8099547511312217,221,0.9061488673139159,618.0,0.4394822006472492
5769,Grouped Improved Agricultural Land Management Project in Shandong Province,China,VM0042,ALM,52708,0.043478260869565216,69,0.2579185520361991,221,0.16990291262135923,618.0,0.2144402911666339
5770,REDD+ Sertão Veredas,Brazil,VM0048,ARR; REDD,79560,1.0,1,0.2413793103448276,29,0.35714285714285715,14.0,0.7586206896551724
5766,Agrokoncernas Carbon Farming Initiative,Lithuania,VM0042,ALM,209333,1.0,4,0.5746606334841629,221,0.7524271844660194,618.0,0.42533936651583715
5764,PEWMA PATAGONIA CARBON FORESTRY PROJECT,Argentina,VM0047,ARR,2430,0.15384615384615385,13,0.09550561797752809,178,0.11449016100178891,559.0,0.05834053586862577
5763,Grande Sun Gabon Ogooué-Ivindo REDD+ Project,Gabon ,VM0007; VM0048,REDD,2976683,1.0,1,0.8571428571428571,7,0.9292604501607717,311.0,0.1428571428571429
5760,Acorn - Kaderes Smallholder Agroforestry in Tanzania,Tanzania,VM0047,ARR,476494,1.0,4,0.8651685393258427,178,0.8819320214669052,559.0,0.1348314606741573
5758,Go Green Jojoba Afforestation Project,Egypt,VM0047,ARR,44834,1.0,1,0.3539325842696629,178,0.4865831842576029,559.0,0.6460674157303371
5755,SATROKALA ARR GROUPED PROJECT,Madagascar,VM0047,ARR,49971,1.0,3,0.38764044943820225,178,0.5152057245080501,559.0,0.6123595505617978
5746,DORNOD SUSTAINABLE GRASSLAND MANAGEMENT PROJECT,Mongolia,VM0042,ALM,800000,0.9285714285714286,7,0.834841628959276,221,0.9231391585760518,618.0,0.09372979961215255
5747,SELENGE SUSTAINABLE GRASSLAND MANAGEMENT PROJECT,Mongolia,VM0042,ALM,180000,0.42857142857142855,7,0.5384615384615384,221,0.7330097087378641,618.0,0.30443828016643554
5748,SUKHBAATAR SUSTAINABLE GRASSLAND MANAGEMENT PROJECT,Mongolia,VM0042,ALM,800000,0.9285714285714286,7,0.834841628959276,221,0.9231391585760518,618.0,0.09372979961215255
5743,Proyecto Tatú: Restoring the Chaco Forest in Argentina,Argentina,VM0047,ARR,46238,0.7692307692307693,13,0.37640449438202245,178,0.5026833631484794,559.0,0.3928262748487468
5739,Tumed Left Banner Improved Agricultural Land Management Project,China,VM0042,ALM,76540,0.11594202898550725,69,0.31221719457013575,221,0.6310679611650486,618.0,0.5151259321795414
5736,Kapuas Pisau Conservation Project,Indonesia,VM0007; VM0047,ARR; REDD; WRC,83123,0.3333333333333333,3,0.16666666666666666,6,0.16666666666666666,12.0,0.16666666666666666
5730,MoRe Malawi ARR Project,Malawi,VM0047,ARR,896410,1.0,4,0.9213483146067416,178,0.9427549194991055,559.0,0.0786516853932584
5732,MoRe Malawi REDD Project,Malawi,VM0048,REDD,154902,1.0,1,0.41379310344827586,29,0.3665594855305466,311.0,0.6334405144694534
5725,"Improved Agricultural Land Management for Verified Carbon Emission Reduction and Removal in Wa West and Daffiama-Bussie-Issah (DBI) Districts, Ghana",Ghana,VM0042,ALM,385080,1.0,2,0.6742081447963801,221,0.8349514563106796,618.0,0.32579185520361986
5724,INDHEMP AGRICULTURAL HEMP ROTATION - MONTANA,United States,VM0042,ALM,47545,0.18181818181818182,11,0.24434389140271492,221,0.1488673139158576,618.0,0.09547657748685731
5722,JATI DHARMA INDAH PLYWOOD INDUSTRIES IFM PROJECT 1,Indonesia,VM0010,IFM,366498,0.2,5,0.8431372549019608,102,0.8653846153846154,156.0,0.6653846153846155
5723,Urubamba Amazon IFM Project,Peru,VM0010,IFM,537434,0.8,5,0.9117647058823529,102,0.9166666666666666,156.0,0.11666666666666659
5720,Mangrove Conservation Sierra Leone,Sierra Leone,VM0033,ARR; WRC,176391,1.0,2,0.8181818181818182,44,0.7368421052631579,38.0,0.26315789473684215
5718,RENEW TARU ODISHA,India,VM0047,ARR,4814,0.16216216216216217,37,0.1404494382022472,178,0.1735241502683363,559.0,0.03307471206608911
5714,Project Tarsier,Philippines,VM0047,ARR,21784,0.16666666666666666,6,0.2808988764044944,178,0.3738819320214669,559.0,0.20721526535480025
5713,Afforestation Project in Mongolia,Mongolia,VM0047,ARR,1510792,0.75,4,0.9550561797752809,178,0.9695885509838998,559.0,0.21958855098389984
5710,The Soil Center Carbon Initiative,United States,VM0042,ALM,2438383,0.9090909090909091,11,0.9547511312217195,221,0.982200647249191,618.0,0.07310973815828192
5709,TRIUNFO DO XINGU RECOVERY UNIT (URTX) ARR PROJECT,Brazil,VM0047,ARR,76000,0.5,16,0.4943820224719101,178,0.590339892665474,559.0,0.09595787019356394
5704,COMBINED NATIVE SPECIES RESTORATION AND EUCALYPTUS REFORESTATION IN THE BRAGANCA DISTRICT,Portugal,VM0047,ARR,1538,1.0,3,0.06741573033707865,178,0.08228980322003578,559.0,0.9325842696629214
5705,NADOWLI-KALEO CLIMATE-SMART AGRICULTURE CARBON PROJECT,Ghana,VM0042,ALM,211923,0.5,2,0.579185520361991,221,0.7540453074433657,618.0,0.25404530744336573
5706,Amau Ganai REDD+ Project,Papua New Guinea,VM0007; VM0048,REDD,636062,0.25,4,0.2857142857142857,7,0.7234726688102894,311.0,0.4734726688102894
5707,Roots of Change: India Agroforestry Ecosystem Services Initiative,India,VM0047,ARR,210272,0.7297297297297297,37,0.7303370786516854,178,0.7710196779964222,559.0,0.04128994826669252
5703,KwaZulu-Natal Sustainable Landscapes Program (KZNSLP),South Africa,VM0032,ALM,730524,1.0,4,0.75,16,0.9093851132686084,618.0,0.25
5701,Sustainable Regenerative Agriculture Project with Ecologically Oriented and Organic Integration,Kazakhstan,VM0042,ALM,1727889,1.0,5,0.9366515837104072,221,0.9724919093851133,618.0,0.06334841628959276
5699,MONGOLIA AFFORESTATION PROJECT (PHASE II),Mongolia,VM0047,ARR,9573225,1.0,4,1.0,178,1.0,559.0,0.0
5700,EcoHarvest Sustainable Agriculture Project,Kazakhstan,VM0042,ALM,881748,0.8,5,0.8642533936651584,221,0.9368932038834952,618.0,0.13689320388349513
5697,Swiftgreen: Agroforestry for Tribal farmers,India,VM0047,ARR,206332,0.7027027027027027,37,0.7191011235955056,178,0.7674418604651163,559.0,0.06473915776241357
5695,Siluk Peatlands Conservation Project (SPCP),Indonesia,VM0007,REDD; WRC,1147943,0.625,8,0.8135593220338984,118,0.8235294117647058,17.0,0.19852941176470584
5689,Karoo Sustainable Landscapes Program (KSLP),South Africa,VM0032; VM0042,ALM,900000,1.0,1,1.0,1,0.9401294498381877,618.0,0.05987055016181231
5679,Igombe REDD+ Project,Tanzania,VM0048,REDD,197030,0.5,2,0.4827586206896552,29,0.40192926045016075,311.0,0.09807073954983925
5680,CO2ROZO,Colombia,VM0007; VM0042,ALM; REDD; WRC,336242,1.0,1,1.0,1,1.0,1.0,0.0
5678,Logged to Protected Forest Spain,Spain,VM0010,IFM,378,1.0,1,0.0196078431372549,102,0.03205128205128205,156.0,0.9803921568627451
5676,MISITU ARR PROJECT - MT. KENYA REGION,Kenya,VM0047,ARR,521726,1.0,3,0.8876404494382022,178,0.9033989266547406,559.0,0.1123595505617978
5670,"Mixed afforestation in Puerto Valle Nuevo, Corrientes, Argentina",Argentina,VM0047,ARR,42860,0.5384615384615384,13,0.34269662921348315,178,0.47584973166368516,559.0,0.19576490924805529
5671,Lisala REDD+ Project,"Congo, The Democratic Republic of The",VM0007,REDD,719149,1.0,1,0.711864406779661,118,0.7395498392282959,311.0,0.288135593220339
5673,California Impact Project,United States,VM0047,ARR,8795180,1.0,5,0.9943820224719101,178,0.998211091234347,559.0,0.005617977528089901
5669,DIMITRA CARBON: MEXICO CONSERVATION PROJECT,Mexico,VM0047,ARR,155694,1.0,2,0.651685393258427,178,0.7137745974955277,559.0,0.348314606741573
5663,The Lam Son Regenerative Sugarcane Project,Viet Nam,VM0042,ALM,1135,1.0,1,0.06787330316742081,221,0.025889967637540454,618.0,0.9741100323624595
5662,Brazilian Citrus Program For Climate Adaptation,Brazil,VM0042,ALM,93260,0.13333333333333333,15,0.3438914027149321,221,0.6440129449838188,618.0,0.5106796116504855
5660,Tukuze,Kenya,VM0047,ARR,240641,0.6666666666666666,3,0.7471910112359551,178,0.7871198568872988,559.0,0.12045319022063217
5655,Lumwana REDD+ Project,Zambia,VM0048,REDD,203302,1.0,2,0.5172413793103449,29,0.4115755627009646,311.0,0.5884244372990354
5652,Boreal Mix,Sweden,VM0012,IFM,36334,1.0,1,0.6111111111111112,18,0.34615384615384615,156.0,0.6538461538461539
5653,Green Portneuf Project,Canada,VM0034,IFM,44000,0.8181818181818182,11,0.75,12,0.40384615384615385,156.0,0.4143356643356644
5651,Carbon Smart Farming Initiative,South Africa,VM0042,ALM,171510,0.6,5,0.5158371040723982,221,0.7216828478964401,618.0,0.20584574382404186
5643,Oyu – Green Growth Uganda,Uganda,VM0047,ARR,65085,0.5,4,0.46629213483146065,178,0.5688729874776386,559.0,0.10258085264617794
5638,Henan Wancheng Improved Agricultural Land Management Project,China,VM0042,ALM,155063,0.4782608695652174,69,0.4751131221719457,221,0.7038834951456311,618.0,0.2287703729736854
5639,Sustainable Grassland Management Project in Sukhbaatar Province,Mongolia,VM0042,ALM,162000,0.2857142857142857,7,0.49321266968325794,221,0.7119741100323624,618.0,0.42625982431807674
5640,Sustainable Grassland Management Project in Tov Province,Mongolia,VM0042,ALM,200000,0.6428571428571429,7,0.5633484162895928,221,0.7467637540453075,618.0,0.18341533775571472
5637,REDD+ PROJECT ARARA PEOPLE,Brazil,VM0048,REDD,1539048,1.0,11,0.9655172413793104,29,0.8778135048231511,311.0,0.12218649517684887
5634,Lower Sepik REDD+ Project,Papua New Guinea,VM0007; VM0048,REDD,655969,0.5,4,0.42857142857142855,7,0.7266881028938906,311.0,0.2981166743224621
5628,Greening of the dried Aral Sea,Kazakhstan,VM0047,ARR,9123,1.0,1,0.1853932584269663,178,0.25402504472271914,559.0,0.8146067415730337
5632,Green and Carbon Capture project,Colombia,VM0047,ARR,15759,0.6666666666666666,6,0.25842696629213485,178,0.34525939177101966,559.0,0.4082397003745318
5631,Enviro Rise,Indonesia,VM0007; VM0047,ARR; REDD; WRC,1316941,1.0,3,0.8333333333333334,6,0.75,12.0,0.25
5624,MANDJI IMPROVEMENT,Gabon ,VM0035,IFM,323996,1.0,1,1.0,1,0.8461538461538461,156.0,0.15384615384615385
5625,MANDJI PROTECTION,Gabon ,VM0010,IFM,58429,1.0,1,0.4117647058823529,102,0.48717948717948717,156.0,0.5882352941176471
5620,"CARBON AGROFORESTRY IN CIMANUK, PROGO AND BRANTAS WATERSHED - INDONESIA",Indonesia,VM0047,ARR,826,0.2,5,0.05056179775280899,178,0.0626118067978533,559.0,0.149438202247191
5618,TOURBA PROJECT – IMPROVED AGRICULTURAL PRACTICES IN BRAZIL,Brazil,VM0042,ALM,2625935,0.9333333333333333,15,0.9592760180995475,221,0.9838187702265372,618.0,0.05048543689320384
5615,Regenerative Agriculture and Forestry Technologies (RAFT),Malawi,VM0047,ARR,135668,0.75,4,0.6235955056179775,178,0.6905187835420393,559.0,0.1264044943820225
5610,AgriCarbon Regenerative Orchards,Israel,VM0042,ALM,9000,0.5,6,0.12669683257918551,221,0.05663430420711974,618.0,0.44336569579288027
5607,Humus Program,France,VM0042,ALM,733000,1.0,3,0.8190045248868778,221,0.9110032362459547,618.0,0.1809954751131222
5608,Manduri Caatinga Grouped IFM Project,Brazil,VM0003,IFM,91,1.0,1,0.05555555555555555,18,0.01282051282051282,156.0,0.9871794871794872
5595,Improved Agricultural Land Management Grouped Carbon Project In India,India,VM0042,ALM,65047,0.48148148148148145,27,0.2850678733031674,221,0.610032362459547,618.0,0.32496448915637954
5594,Climate Resilient Bamboo Plantations for Enhancing Rural Livelihoods in India,India,VM0047,ARR,101846,0.5135135135135135,37,0.5674157303370787,178,0.6493738819320215,559.0,0.13586036841850802
5592,Climate Smart Agroforestry for Carbon Sequestration in India,India,VM0047,ARR,141707,0.5945945945945946,37,0.6292134831460674,178,0.6958855098389982,559.0,0.10129091524440359
5593,Growing Carbon Sinks through Agroforestry in India,India,VM0047,ARR,100501,0.4864864864864865,37,0.5617977528089888,178,0.6475849731663685,559.0,0.16109848667988202
5589,Incentivising Biodiversity and Climate Resilience Initiative,India,VM0047,ARR,159434,0.6216216216216216,37,0.6629213483146067,178,0.7227191413237924,559.0,0.10109751970217085
5590,NATURALL CARBON PROGRAM: REGENERATIVE AGRICULTURE IN BRAZIL – PROJECT IV,Brazil,VM0042,ALM,1562585,0.7,15,0.9253393665158371,221,0.9684466019417476,618.0,0.26844660194174763
5591,NATURALL CARBON PROGRAM: REGENERATIVE AGRICULTURE IN BRAZIL – PROJECT V,Brazil,VM0042,ALM,1562585,0.7,15,0.9253393665158371,221,0.9684466019417476,618.0,0.26844660194174763
5587,Conkouati-Douli National Park REDD+ Project,Congo,VM0007,REDD,372678,1.0,1,0.559322033898305,118,0.617363344051447,311.0,0.44067796610169496
5585,PROJECT LESTARI,Indonesia,VM0007; VM0048,REDD,2351492,1.0,1,0.7142857142857143,7,0.909967845659164,311.0,0.2857142857142857
5581,Carbon sequestration through Mangrove Afforestation & Restoration in Bangladesh,Bangladesh,VM0033,ARR; WRC,37724,1.0,1,0.36363636363636365,44,0.3157894736842105,38.0,0.6842105263157895
5578,Re.green Landscapes: Native Forest Restoration in the Atlantic Forest,Brazil,VM0047,ARR,115389,0.625,16,0.6123595505617978,178,0.6726296958855098,559.0,0.060270145323712
5580,Akiing Azhenan Improved Forest Management Project,United States,VM0045,IFM,25000,0.3333333333333333,3,0.42857142857142855,7,0.2692307692307692,156.0,0.15934065934065933
5576,Chatham Islands / Rekohu Natural Regeneration Project,New Zealand,VM0047,ARR,150166,1.0,2,0.6460674157303371,178,0.7084078711985689,559.0,0.3539325842696629
5571,"Tea Shade Development and Ecological (TSHADE) Restoration Project, Sri Lanka",Sri Lanka,VM0047,ARR; IFM,567471,1.0,1,0.8932584269662921,178,0.875,8.0,0.125
5570,Bago Bamboo for Climate Carbon Forest Project,Myanmar,VM0047,ARR,4169,1.0,1,0.12921348314606743,178,0.1520572450805009,559.0,0.8707865168539326
5568,TOURBA PROJECT – IMPROVED AGRICULTURE PRACTICES IN NIGERIA,Nigeria,VM0042,ALM,651199,1.0,1,0.7828054298642534,221,0.8932038834951457,618.0,0.2171945701357466
5566,Boomitra Grassland Restoration in Costa Rica,Costa Rica,VM0042,ALM,169950,1.0,1,0.5113122171945701,221,0.7184466019417476,618.0,0.4886877828054299
5567,Regenerative Agriculture Initiative 'Insoil',Poland,VM0042,ALM,533032,0.75,4,0.748868778280543,221,0.8729773462783171,618.0,0.12410856799777414
5565,Projeto REDD+ Xikrin do Cateté,Brazil,VM0048,REDD,1111885,0.9090909090909091,11,0.896551724137931,29,0.8295819935691319,311.0,0.07950891552177719
5562,Galician Atlantic Forest Restoration Grouped Project,Spain,VM0047,ARR,2544,1.0,1,0.10112359550561797,178,0.11806797853309481,559.0,0.898876404494382
5555,KOSHER BLUE CARBON - 2,India,VM0033,ARR,57316,0.6666666666666666,3,0.4772727272727273,44,0.5491949910554562,559.0,0.18939393939393934
5556,Green Samar,Philippines,VM0047,ARR,312464,0.8333333333333334,6,0.8089887640449438,178,0.8193202146690519,559.0,0.024344569288389573
5545,YAKOPI Mangrove Restoration Project,Indonesia,VM0033,ARR; WRC,38870,0.3333333333333333,3,0.38636363636363635,44,0.34210526315789475,38.0,0.05303030303030304
5535,RALICÓ FARM: A MODEL FOR REGENERATIVE GRAZING,Argentina,VM0042,ALM,9400,0.2857142857142857,7,0.13122171945701358,221,0.059870550161812294,618.0,0.2258437355524734
5533,"PROJECT TO AFFOREST AND PRESERVE DEGRADED AND FALLOW INDIGENOUSLY OWNED LANDS IN WEST BENGAL, INDIA",India,VM0047,ARR,20000,0.24324324324324326,37,0.2696629213483146,178,0.3667262969588551,559.0,0.12348305371561186
