resourceIdentifier,resourceName,country,protocols,protocolSubCategories,estAnnualEmissionReductions,M4_tight,n_tight,M4_methodology,n_methodology,M4_subcat,n_subcat,M4_range
3119,Chaoyang Adjusted Water Management in Rice Cultivation,China,AMS-III.AU,ALM,59666,0.7236363636363636,275,0.7206896551724138,290,0.48220064724919093,618.0,0.2414357163871727
3120,Longxin Adjusted Water Management in Rice Cultivation,China,AMS-III.AU,ALM,59946,0.9381818181818182,275,0.9241379310344827,290,0.5792880258899676,618.0,0.3588937922918506
3121,Qingshan Adjusted Water Management in Rice Cultivation,China,AMS-III.AU,ALM,59978,0.9490909090909091,275,0.9344827586206896,290,0.5841423948220065,618.0,0.3649485142689026
3122,Qixing Adjusted Water Management in Rice Cultivation,China,AMS-III.AU,ALM,59868,0.8090909090909091,275,0.8017241379310345,290,0.5218446601941747,618.0,0.28724624889673434
3114,Developing voluntary carbon market project for Dudhwa Tiger Reserve in India,India,VM0037,REDD,358584,1.0,4,1.0,6,0.6077170418006431,311.0,0.3922829581993569
3115,Sustainable agricultural practices for carbon sequestration by Organic and Natural farming groups,India,VM0017,ALM,686959,0.8571428571428571,21,0.8484848484848485,33,0.8980582524271845,618.0,0.049573403942336
3110,Adjusted Water Management in Rice Cultivation in Wuhua County,China,AMS-III.AU,ALM,59274,0.5963636363636363,275,0.6,290,0.4255663430420712,618.0,0.17443365695792878
3100,Hayi Water Management with Rice Cultivation,China,AMS-III.AU,ALM,59397,0.6436363636363637,275,0.6448275862068965,290,0.44660194174757284,618.0,0.19822564445932367
3102,Sipso Water Management with Rice Cultivation,China,AMS-III.AU,ALM,59661,0.72,275,0.7172413793103448,290,0.48058252427184467,618.0,0.2394174757281553
3103,Weicuan-1 Water Management with Rice Cultivation,China,AMS-III.AU,ALM,59716,0.7418181818181818,275,0.7379310344827587,290,0.49029126213592233,618.0,0.2515269196822595
3104,Weicuan-2 Water Management with Rice Cultivation,China,AMS-III.AU,ALM,59634,0.7090909090909091,275,0.7068965517241379,290,0.47572815533980584,618.0,0.23336275375110327
3105,Zhuangmiao-1 Water Management with Rice Cultivation,China,AMS-III.AU,ALM,59921,0.8927272727272727,275,0.8810344827586207,290,0.5590614886731392,618.0,0.3336657840541335
3106,Zhuangmiao-2 Water Management with Rice Cultivation,China,AMS-III.AU,ALM,59423,0.6472727272727272,275,0.6482758620689655,290,0.4482200647249191,618.0,0.20005579734404638
3107,Zhuangmiao-3 Water Management with Rice Cultivation,China,AMS-III.AU,ALM,59657,0.7163636363636363,275,0.7137931034482758,290,0.47896440129449835,618.0,0.23739923506913796
3108,Zhuangmiao-4 Water Management with Rice Cultivation,China,AMS-III.AU,ALM,59208,0.5745454545454546,275,0.5793103448275863,290,0.41585760517799353,618.0,0.16345273964959273
3098,TabasCO2 Afforestation Project,Mexico,AR-ACM0003,ARR,195925,1.0,5,0.7007299270072993,274,0.7602862254025045,559.0,0.2992700729927007
3093,INDIA CARBON PROGRAM:AWD/DSR,India,AMS-III.AU,ALM,52158,0.26666666666666666,15,0.06206896551724138,290,0.16019417475728157,618.0,0.20459770114942527
3079,Buyi-1 Adjusted Water Management in Rice Cultivation,China,AMS-III.AU,ALM,59711,0.7381818181818182,275,0.7344827586206897,290,0.4886731391585761,618.0,0.24950867902324209
3081,Buyi-2 Adjusted Water Management in Rice Cultivation,China,AMS-III.AU,ALM,58319,0.4036363636363636,275,0.41724137931034483,290,0.33818770226537215,618.0,0.07905367704497268
3082,Chiyou-1 Adjusted Water Management in Rice Cultivation,China,AMS-III.AU,ALM,59826,0.7745454545454545,275,0.7689655172413793,290,0.5064724919093851,618.0,0.2680729626360694
3083,Lincheng-1 Adjusted Water Management in Rice Cultivation,China,AMS-III.AU,ALM,59645,0.7127272727272728,275,0.7103448275862069,290,0.4773462783171521,618.0,0.23538099441012067
3084,Wuling-1 Adjusted Water Management in Rice Cultivation,China,AMS-III.AU,ALM,59140,0.5563636363636364,275,0.5620689655172414,290,0.4077669902912621,618.0,0.15430197522597927
3085,Tunpu Adjusted Water Management in Rice Cultivation,China,AMS-III.AU,ALM,59288,0.6036363636363636,275,0.6068965517241379,290,0.42880258899676377,618.0,0.17809396272737416
3086,Chiyou-2 Adjusted Water Management in Rice Cultivation,China,AMS-III.AU,ALM,59337,0.6181818181818182,275,0.6206896551724138,290,0.43527508090614886,618.0,0.18541457426626495
3087,Lincheng-2 Adjusted Water Management in Rice Cultivation,China,AMS-III.AU,ALM,59293,0.610909090909091,275,0.6137931034482759,290,0.4320388349514563,618.0,0.18175426849681958
3088,Wuling-2 Adjusted Water Management in Rice Cultivation,China,AMS-III.AU,ALM,58656,0.4690909090909091,275,0.4793103448275862,290,0.3673139158576052,618.0,0.11199642896998102
3089,Chiyou-3 Adjusted Water Management in Rice Cultivation,China,AMS-III.AU,ALM,59572,0.6872727272727273,275,0.6862068965517242,290,0.46601941747572817,618.0,0.2212533097969991
3090,Zangke Adjusted Water Management in Rice Cultivation,China,AMS-III.AU,ALM,58993,0.5236363636363637,275,0.5310344827586206,290,0.3932038834951456,618.0,0.13783059926347502
3091,Wumeng Adjusted Water Management in Rice Cultivation,China,AMS-III.AU,ALM,59445,0.6509090909090909,275,0.6517241379310345,290,0.44983818770226536,618.0,0.2018859502287691
3074,Guangxi Tianyang IFM (conversion of logged to protected forest) Project,China,VM0010,IFM,88226,0.6764705882352942,68,0.5392156862745098,102,0.5705128205128205,156.0,0.13725490196078438
3072,Rwanda Riparian Restoration Project,Rwanda,AR-ACM0003,ARR,51964,0.5,2,0.4927007299270073,274,0.5241502683363148,559.0,0.03144953840930753
3067,Sustainable Agricultural Land Management Project by Amiha Agro Private Limited,India,VM0017,ALM,256116,0.6666666666666666,21,0.7272727272727273,33,0.7766990291262136,618.0,0.11003236245954695
3065,Sustainable Agricultural Improvement Practices in Punjab,India,VM0017,ALM,66175,0.47619047619047616,21,0.5151515151515151,33,0.6132686084142395,618.0,0.1370781322237633
3057,"Tlawan kiwi nak chuchit Blue Carbon Mangrove Conservation Project, Conserving Coastal Ecosystems in Veracruz to Support Life",Mexico,VM0007,REDD; WRC,65946,0.5,4,0.17796610169491525,118,0.23529411764705882,17.0,0.3220338983050848
3053,Sustainable Agricultural Land Management Project by Greneity,India,VM0042,ALM,173250,0.6296296296296297,27,0.5203619909502263,221,0.7233009708737864,618.0,0.20293897992356014
3055,Itaúba REDD+ Project,Brazil,VM0015,REDD,28655,0.140625,64,0.13157894736842105,114,0.09003215434083602,311.0,0.050592845659163985
3050,Maraui Program - Grouped Project,Brazil,VM0009,ACoGS; REDD,200000,1.0,1,0.2413793103448276,29,1.0,1.0,0.7586206896551724
3048,Keyue Adjusted Water Management in Rice Cultivation,China,AMS-III.AU,ALM,59856,0.7945454545454546,275,0.7879310344827586,290,0.5153721682847896,618.0,0.27917328626066495
3049,Rio Preto Grouped REDD+ Project,Brazil,VM0015,REDD,2925,0.015625,64,0.02631578947368421,114,0.01607717041800643,311.0,0.010690789473684209
3040,RIMBOSCHIMENTO PROGETTO DELLA SOCIETA' AGRICOLA GAIA SRL BAMBOO PLANT,Italy,AR-ACM0003,ARR,234783,0.6666666666666666,3,0.7226277372262774,274,0.7835420393559929,559.0,0.11687537268932624
3023,BONOS DE LA RUTA SIAN KA'AN,Mexico,VM0003,IFM,694509,1.0,3,0.9444444444444444,18,0.9487179487179487,156.0,0.05555555555555558
3024,Puwangzi Afforestation Project,China,AR-ACM0003,ARR,247688,0.48484848484848486,66,0.7335766423357665,274,0.7906976744186046,559.0,0.30584918957011975
3018,BigCoast Forest Climate Initiative,Canada,VM0012,IFM,715834,1.0,6,1.0,18,0.9551282051282052,156.0,0.04487179487179482
3019,REGENERATING DEGRADED LANDS IN FLORIDA THROUGH PONGAMIA,United States,AR-AMS0007,ARR,4133,1.0,1,0.35714285714285715,42,0.15026833631484796,559.0,0.8497316636851521
3012,Agroforestry and Reforestation for Carbon Sequestration in Indonesia,Indonesia,AR-AMS0007,ARR,1888,0.5,2,0.2619047619047619,42,0.09481216457960644,559.0,0.40518783542039355
3013,Andes Inorganic Carbon Capture on Agricultural Soils,United States,VM0021,ALM,137464688,1.0,1,1.0,1,1.0,618.0,0.0
3014,Patagonia Region Improved Grazing Project,Argentina,VM0026,ALM,24952,0.5,2,0.06382978723404255,47,0.09223300970873786,618.0,0.43617021276595747
3015,Northern Great Plains Regenerative Grazing Project 2,United States,VM0026,ALM,17000,0.5,2,0.0425531914893617,47,0.07928802588996764,618.0,0.4574468085106383
3001,Jiangxi Tonggu Improved Forest Management Project,China,VM0010,IFM,51607,0.4264705882352941,68,0.3431372549019608,102,0.4423076923076923,156.0,0.0991704374057315
3002,Hiwi REDD+ Project,Brazil,VM0015,REDD,88084,0.390625,64,0.3157894736842105,114,0.2572347266881029,311.0,0.13339027331189712
2996,NATURE GENERATOR ONE  Northern Mexico Sustainable Grazing Carbon Capture Project,Mexico,VM0026,ALM; ARR,11805,1.0,1,0.02127659574468085,47,0.2222222222222222,9.0,0.9787234042553191
2992,HG Afforestation Through High Quality Timber Over Degraded Grasslands,Uruguay,AR-ACM0003,ARR,2056,0.2222222222222222,9,0.0948905109489051,274,0.10554561717352415,559.0,0.1273317112733171
2980,Feijó REDD+ Project,Brazil,VM0007; VM0015,REDD,238463,0.8,5,0.8,5,0.4662379421221865,311.0,0.33376205787781354
2971,OKA 2 PROJECT,Congo,AR-ACM0003,ARR,19976,0.5,2,0.31386861313868614,274,0.36493738819320215,559.0,0.18613138686131386
2972,Sustainable Agriculture Land Management Project by Earthallica Naturals,India,VM0017,ALM,20000,0.23809523809523808,21,0.2727272727272727,33,0.0825242718446602,618.0,0.1902030008826125
2974,Aztlan Blue Carbon Mangrove CONSERVATION project - Conserving the Marismas NACIONALES of Nayarit,Mexico,VM0007,REDD; WRC,323590,0.75,4,0.5169491525423728,118,0.5294117647058824,17.0,0.23305084745762716
2975,"U' Balam'moo A'kalché ó Blue Carbon Mangrove Conservation Project, Conserving Coastal Ecosystems in Campeche to Support Life",Mexico,VM0007,REDD; WRC,667276,1.0,4,0.6949152542372882,118,0.7058823529411765,17.0,0.30508474576271183
2976,"Uh lu'umil Zazil-ha Blue Carbon Mangrove Conservation Project, Conserving Coastal Ecosystems in Quintana Roo to Support Life",Mexico,VM0007,REDD; WRC,1718,0.25,4,0.01694915254237288,118,0.058823529411764705,17.0,0.2330508474576271
2959,Reforestation Project in Meghalaya by Shillong Bamboo,India,AR-ACM0003,ARR,100000,0.6964285714285714,56,0.6058394160583942,274,0.6457960644007156,559.0,0.0905891553701772
2965,Niger Acacia Senegal Plantation Project - CER Conversion,Niger,AR-ACM0003,ARR,24957,0.75,2,0.3448905109489051,274,0.39087656529516995,559.0,0.4051094890510949
2958,Lanao del Sur Bamboo Reforestation Project,Philippines,AR-ACM0003,ARR,315067,1.0,2,0.7591240875912408,274,0.8211091234347049,559.0,0.24087591240875916
2952,Not Hot Afforestation project,Latvia,AR-ACM0003,ARR,50,1.0,1,0.025547445255474453,274,0.016100178890876567,559.0,0.9838998211091234
2950,Atlantic Forest Biodiversity Conservation Limeira Project REDD,Brazil,VM0007,REDD,11266,0.02631578947368421,38,0.0423728813559322,118,0.04823151125401929,311.0,0.02191572178033508
2937,Hubei Yunyang IFM (CONVERSION OF LOGGED TO PROTECTED FOREST) PROJECT,China,VM0010,IFM,37754,0.3088235294117647,68,0.2549019607843137,102,0.358974358974359,156.0,0.10407239819004527
2936,Hunan Cili IFM (conversion of logged to protected forest) Project,China,VM0010,IFM,44014,0.38235294117647056,68,0.3137254901960784,102,0.41025641025641024,156.0,0.09653092006033182
2934,Boomitra Carbon Farming in the Indo-Gangetic Plains,India,VM0042,ALM,350000,0.7407407407407407,27,0.6606334841628959,221,0.8252427184466019,618.0,0.164609234283706
2933,Solve for Carbon Neutrality - LTI’s Afforestation Program,India,AR-AMS0007,ARR,956,0.3076923076923077,13,0.19047619047619047,42,0.06618962432915922,559.0,0.2415026833631485
2931,Grassland Restoration and Stewardship in South Africa (GRASS),South Africa,VM0042,ALM,639503,1.0,5,0.7782805429864253,221,0.8915857605177994,618.0,0.22171945701357465
2928,"North Bandai Bamboo Reforestation Project, Ghana",Ghana,AR-ACM0003,ARR,107907,0.8,5,0.6131386861313869,274,0.6565295169946332,559.0,0.18686131386861315
2929,"Bandai Hills Bamboo Reforestation Project, Ghana",Ghana,AR-ACM0003,ARR,188926,1.0,5,0.6970802919708029,274,0.7584973166368515,559.0,0.3029197080291971
2926,Afforestation Project,China,AR-ACM0003,ARR; IFM; REDD,768220,1.0,5,0.9379562043795621,274,0.8571428571428571,7.0,0.1428571428571429
2921,Jilin Baishishan Afforestation Project,China,AR-ACM0003,ARR,388261,0.6818181818181818,66,0.8065693430656934,274,0.8568872987477638,559.0,0.17506911692958205
2915,Adjusted Water Management in Rice Cultivation in Jiashan County,China,AMS-III.AU,ALM,59904,0.8690909090909091,275,0.8586206896551725,290,0.5485436893203883,618.0,0.3205472197705208
2916,Linjianchun Adjusted Water Management in Rice Cultivation,China,AMS-III.AU,ALM,59905,0.8727272727272727,275,0.8620689655172413,290,0.5501618122977346,618.0,0.32256546042953804
2917,Adjusted Water Management in Rice Cultivation in Shengzhou City,China,AMS-III.AU,ALM,59727,0.7454545454545455,275,0.7413793103448276,290,0.4919093851132686,618.0,0.2535451603412769
2918,Adjusted Water Management in Rice Cultivation in Changxing County,China,AMS-III.AU,ALM,59803,0.7636363636363637,275,0.7586206896551724,290,0.5016181229773463,618.0,0.26201824065901735
2919,Adjusted Water Management in Rice Cultivation in Western Zhuji City,China,AMS-III.AU,ALM,59882,0.8345454545454546,275,0.8258620689655173,290,0.5331715210355987,618.0,0.30137393350985586
2899,Adjusted Water Management in Rice Cultivation In Dawu County,China,AMS-III.AU,ALM,59923,0.9036363636363637,275,0.8913793103448275,290,0.563915857605178,618.0,0.33972050603118564
2900,Adjusted Water Management in Rice Cultivation In Daye City,China,AMS-III.AU,ALM,59949,0.9418181818181818,275,0.9275862068965517,290,0.580906148867314,618.0,0.3609120329508678
2901,Adjusted Water Management in Rice Cultivation In Hanchuan City,China,AMS-III.AU,ALM,59832,0.7836363636363637,275,0.7775862068965518,290,0.5105177993527508,618.0,0.2731185642836129
2902,Adjusted Water Management in Rice Cultivation In Huangmei County,China,AMS-III.AU,ALM,59901,0.86,275,0.85,290,0.5444983818770227,618.0,0.3155016181229773
2903,Adjusted Water Management in Rice Cultivation In Xiaochang County,China,AMS-III.AU,ALM,59916,0.8836363636363637,275,0.8724137931034482,290,0.5550161812297735,618.0,0.3286201824065902
2906,Adjusted Water Management in Rice Cultivation In Xiaonan District,China,AMS-III.AU,ALM,59896,0.8490909090909091,275,0.8396551724137931,290,0.5396440129449838,618.0,0.30944689614592535
2907,Adjusted Water Management in Rice Cultivation In Yangxin County,China,AMS-III.AU,ALM,59923,0.9036363636363637,275,0.8913793103448275,290,0.563915857605178,618.0,0.33972050603118564
2909,Adjusted Water Management in Rice Cultivation In Yingcheng City,China,AMS-III.AU,ALM,59902,0.8654545454545455,275,0.8551724137931035,290,0.5469255663430421,618.0,0.31852897911150335
2910,Wude Adjusted Water Management in Rice Cultivation,China,AMS-III.AU,ALM,59751,0.7490909090909091,275,0.7448275862068966,290,0.49514563106796117,618.0,0.253945278022948
2911,Adjusted Water Management in Rice Cultivation in Haiyan County,China,AMS-III.AU,ALM,59882,0.8345454545454546,275,0.8258620689655173,290,0.5331715210355987,618.0,0.30137393350985586
2912,Adjusted Water Management in Rice Cultivation in Tongxiang City,China,AMS-III.AU,ALM,59863,0.8,275,0.7931034482758621,290,0.517799352750809,618.0,0.28220064724919103
2914,BONOS LAGUNA SÍJIL NOH-HÁ,Mexico,VM0003,IFM,516815,0.6666666666666666,3,0.8888888888888888,18,0.9038461538461539,156.0,0.23717948717948723
2891,Adjusted Water Management in Rice Cultivation In Jiangxia District,China,AMS-III.AU,ALM,59924,0.9090909090909091,275,0.896551724137931,290,0.5663430420711975,618.0,0.3427478670197116
2892,Adjusted Water Management in Rice Cultivation In Wuxue City,China,AMS-III.AU,ALM,59919,0.8872727272727273,275,0.8758620689655172,290,0.5566343042071198,618.0,0.33063842306560753
2893,Liaoyuan Afforestation Project,China,AR-ACM0003,ARR,87387,0.3181818181818182,66,0.572992700729927,274,0.6189624329159212,559.0,0.30078061473410306
2894,Adjusted Water Management in Rice Cultivation In Xinzhou District,China,AMS-III.AU,ALM,59945,0.9345454545454546,275,0.9206896551724137,290,0.5776699029126213,618.0,0.35687555163283324
2897,Forest Conservation in Boumba-et-Ngoko,Cameroon,VM0010,IFM,362095,1.0,1,0.8333333333333334,102,0.8589743589743589,156.0,0.16666666666666663
2889,Boomitra Carbon Farming South of the Vindhyas,India,VM0042,ALM,676391,0.8518518518518519,27,0.7918552036199095,221,0.8964401294498382,618.0,0.10458492582992873
2884,Gansu Zhangye Grouped Afforestation Project,China,AR-ACM0003,ARR,376953,0.6666666666666666,66,0.7992700729927007,274,0.851520572450805,559.0,0.1848539057841384
2887,Boomitra Grassland Restoration in Northern Mexico,Mexico,VM0042,ALM,7294407,1.0,1,0.995475113122172,221,0.9967637540453075,618.0,0.004524886877828038
2882,GUANGXI FANGCHENG DISTRICT IFM (CONVERSION OF LOGGED TO PROTECTED FOREST) PROJECT,China,VM0010,IFM,94951,0.7058823529411765,68,0.5588235294117647,102,0.5897435897435898,156.0,0.1470588235294118
2881,The NFC Uganda Carbon Landscapes Project,Uganda,VM0003; AR-ACM0003,ARR; IFM,74328,1.0,1,1.0,1,0.5,8.0,0.5
2877,Adjusted Water Management in Rice Cultivation In Huangpi District,China,AMS-III.AU,ALM,59935,0.9236363636363636,275,0.9103448275862069,290,0.5728155339805825,618.0,0.3508208296557811
2878,Rio Madeira Grouped REDD+ Project,Brazil,VM0015,REDD,917817,0.90625,64,0.7543859649122807,114,0.7717041800643086,311.0,0.15186403508771928
2873,Caelus Grouped Project,Chile,VM0003,IFM,111,0.5,2,0.1111111111111111,18,0.019230769230769232,156.0,0.4807692307692308
2874,Proventus Grouped Project,Chile,AR-ACM0003,ARR,2301,0.5,2,0.10218978102189781,274,0.11270125223613596,559.0,0.3978102189781022
2872,CRIMA PREDIO PUTUMAYO Y ANDOQUE DE ADUCHE REDD+  PROJECT,Colombia,VM0007,REDD,922896,0.75,8,0.7711864406779662,118,0.7781350482315113,311.0,0.02813504823151125
2870,Gairova REDD+ Project,Brazil,VM0015,REDD,139176,0.53125,64,0.4298245614035088,114,0.34726688102893893,311.0,0.18398311897106107
2871,Green Valley Grouped REDD+ Project,Brazil,VM0015,REDD,74913,0.359375,64,0.2982456140350877,114,0.2315112540192926,311.0,0.1278637459807074
2867,Sustainable Agricultural Land Management Project by Om Organic  Cotton,India,VM0017,ALM,956199,1.0,21,0.9393939393939394,33,0.9449838187702265,618.0,0.06060606060606055
2853,Yufeng Adjusted Water Management in Rice Cultivation,China,AMS-III.AU,ALM,59796,0.7581818181818182,275,0.753448275862069,290,0.49919093851132684,618.0,0.25899087967049134
2854,Hongmei Adjusted Water Management in Rice Cultivation,China,AMS-III.AU,ALM,59261,0.5854545454545454,275,0.5896551724137931,290,0.42071197411003236,618.0,0.1689431983037607
2855,Zhengtongsui Adjusted Water Management in Rice Cultivation,China,AMS-III.AU,ALM,59493,0.6727272727272727,275,0.6724137931034483,290,0.459546925566343,618.0,0.2131803471609297
2856,Wudao Adjusted Water Management in Rice Cultivation,China,AMS-III.AU,ALM,58633,0.46545454545454545,275,0.47586206896551725,290,0.3656957928802589,618.0,0.11016627608525836
2857,Integrated REDD+ Project in Zambia,Zambia,VM0015,REDD,3010753,0.75,4,0.9298245614035088,114,0.9356913183279743,311.0,0.18569131832797425
2847,JinNa Adjusted Water Management in Rice Cultivation,China,AMS-III.AU,ALM,59346,0.6218181818181818,275,0.6241379310344828,290,0.4368932038834951,618.0,0.18724472715098767
2849,Bohui Adjusted Water Management in Rice Cultivation,China,AMS-III.AU,ALM,59877,0.8290909090909091,275,0.8206896551724138,290,0.5307443365695793,618.0,0.2983465725213298
2850,Chishui Adjusted Water Management in Rice Cultivation,China,AMS-III.AU,ALM,59267,0.5890909090909091,275,0.593103448275862,290,0.4223300970873786,618.0,0.1707733511884834
2851,Xihuai Adjusted Water Management in Rice Cultivation,China,AMS-III.AU,ALM,59700,0.7345454545454545,275,0.7310344827586207,290,0.48705501618122976,618.0,0.24749043836422474
2852,Xinjiang Burqin Improved Grassland Management Project,China,VM0026,ALM,271847,0.4,40,0.46808510638297873,47,0.7847896440129449,618.0,0.3847896440129449
2843,QianJin Adjusted Water Management in Rice Cultivation,China,AMS-III.AU,ALM,58959,0.5127272727272727,275,0.5206896551724138,290,0.3883495145631068,618.0,0.13234014060930704
2845,QiDa Adjusted Water Management in Rice Cultivation,China,AMS-III.AU,ALM,59352,0.6272727272727273,275,0.6293103448275862,290,0.4393203883495146,618.0,0.1899899564780716
2842,BlueMX Atzlan Blue Carbon Project,Mexico,VM0033,ARR; WRC,307306,1.0,3,0.9318181818181818,44,0.868421052631579,38.0,0.13157894736842102
2833,Grouped Reforestation Project by Cropzone Agro Forestry Private Limited,India,AR-ACM0003,ARR,10673,0.21428571428571427,56,0.21897810218978103,274,0.2701252236135957,559.0,0.055839509327881426
2834,"Mangrove Restoration Project with Sine Saloum and Casamance communities, Senegal",Senegal,AR-AM0014,ARR; WRC,49249,1.0,1,0.5,16,0.42105263157894735,38.0,0.5789473684210527
2791,CONSERVATION OF NATIVE FOREST IN THE BIODIVERSITY HOTSPOT OF PAPUA NEW GUINEA,Papua New Guinea,VM0015,REDD,1134215,0.3333333333333333,3,0.8333333333333334,114,0.8327974276527331,311.0,0.5
2792,Restoration of Degraded Mangroves and Sustainable Development in Myanmar,Myanmar,AR-AM0014,ARR,70285,0.5,2,0.6875,16,0.5778175313059034,559.0,0.1875
2790,The ARR Cerrado Carbon Project,Brazil,AR-ACM0003,ARR,6840106,1.0,22,1.0,274,0.9964221824686941,559.0,0.003577817531305927
2769,Adjusted Water Management in Rice Cultivation in Pinghu City,China,AMS-III.AU,ALM,59927,0.9127272727272727,275,0.9,290,0.5679611650485437,618.0,0.34476610767872906
2770,Yulin Adjusted Water Management in Rice Cultivation,China,AMS-III.AU,ALM,59922,0.8981818181818182,275,0.8862068965517241,290,0.5614886731391586,618.0,0.33669314504265957
2771,Futong Adjusted Water Management in Rice Cultivation,China,AMS-III.AU,ALM,59943,0.9290909090909091,275,0.9155172413793103,290,0.5752427184466019,618.0,0.35384819064430717
2765,"IMPROVED FOREST MANAGEMENT THROUGH LOGGED-TO-PROTECTED FORESTS AND REDUCED IMPACT LOGGING IN UFA NGOMBÉ, REPUBLIC OF CONGO",Congo,VM0010,IFM,413560,0.5,2,0.8627450980392157,102,0.8782051282051282,156.0,0.3782051282051282
2760,REDD+ Project in Oro Province of Papua New Guinea,Papua New Guinea,VM0015,REDD,8099752,0.6666666666666666,3,0.9649122807017544,114,0.9839228295819936,311.0,0.317256162915327
2750,Saving Colombia's Cloud Forest,Colombia,AR-ACM0003,ARR,7920,0.23076923076923078,13,0.1897810218978102,274,0.23971377459749552,559.0,0.04993275269968531
2748,Zhangye Improved Grassland Management Project,China,VM0026,ALM,736006,0.9,40,0.9148936170212766,47,0.912621359223301,618.0,0.014893617021276562
2744,The Paraguayan Chaco Neem Reforestation Project,Paraguay,AR-AMS0007,ARR,12211,1.0,2,0.7142857142857143,42,0.28622540250447226,559.0,0.7137745974955277
2745,Wuwei City Afforestation Project in Gansu Province,China,AR-ACM0003,ARR,63352,0.22727272727272727,66,0.5218978102189781,274,0.5635062611806798,559.0,0.3362335339079525
2743,Guizhou Xingren Afforestation Project,China,AR-ACM0003,ARR,93476,0.3484848484848485,66,0.5875912408759124,274,0.6332737030411449,559.0,0.28478885455629643
2733,Yunnan shizong Afforestation Project,China,AR-ACM0003,ARR,65512,0.25757575757575757,66,0.5291970802919708,274,0.5706618962432916,559.0,0.313086138667534
2729,Guizhou Xingren IFM (conversion of logged to protected forest) Project,China,VM0010,IFM,18460,0.04411764705882353,68,0.0784313725490196,102,0.19230769230769232,156.0,0.14819004524886878
2730,Guangxi Luchuan IFM (conversion of logged to protected forest) Project,China,VM0010,IFM,215680,0.8676470588235294,68,0.7156862745098039,102,0.7564102564102564,156.0,0.1519607843137255
2727,Guangxi Dahua IFM (conversion of logged to protected forest) Project,China,VM0010,IFM,63650,0.5735294117647058,68,0.45098039215686275,102,0.5192307692307693,156.0,0.12254901960784309
2724,Sichuan Yanting IFM (conversion of logged to protected forest) Project,China,VM0010,IFM,19324,0.058823529411764705,68,0.08823529411764706,102,0.1987179487179487,156.0,0.13989441930618401
2723,CONDOTO REDD+,Colombia,VM0007,REDD,249943,0.375,8,0.4576271186440678,118,0.5016077170418006,311.0,0.12660771704180063
2721,Chongqing Pengshui IFM (conversion of logged to protected forest) Project,China,VM0010,IFM,19976,0.07352941176470588,68,0.09803921568627451,102,0.20512820512820512,156.0,0.13159879336349922
2722,Inner Mongolia Alongshan Improved Forest Management Project,China,VM0010,IFM,341879,0.9558823529411765,68,0.8235294117647058,102,0.8525641025641025,156.0,0.13235294117647067
2719,Hubei jianshi IFM (conversion of logged to protected forest) Project,China,VM0010,IFM,53239,0.4411764705882353,68,0.35294117647058826,102,0.44871794871794873,156.0,0.09577677224736048
2715,Inner Mongolia Arxan Improved Forest Management Project,China,VM0010,IFM,372397,0.9705882352941176,68,0.8529411764705882,102,0.8717948717948718,156.0,0.11764705882352944
2710,"Soil carbon improvement Project through Grassland Management, in South Africa",South Africa,VM0026,ALM,254936,1.0,1,0.3617021276595745,47,0.7734627831715211,618.0,0.6382978723404256
2709,Juruena River REDD+ Project,Brazil,VM0015,REDD,100588,0.453125,64,0.35964912280701755,114,0.28938906752411575,311.0,0.16373593247588425
2698,Liaoning Kangping IFM (conversion of logged to protected forest) Project,China,VM0010,IFM,27672,0.17647058823529413,68,0.16666666666666666,102,0.28846153846153844,156.0,0.12179487179487178
2699,Yunnan Shizong IFM (conversion of logged to protected forest) Project,China,VM0010,IFM,67903,0.5882352941176471,68,0.46078431372549017,102,0.5256410256410257,156.0,0.1274509803921569
2694,Fujian Dehua IFM (conversion of logged to protected forest) Project,China,VM0010,IFM,42923,0.35294117647058826,68,0.28431372549019607,102,0.391025641025641,156.0,0.10671191553544496
2674,Inner Mongolia Moerdaoga Improved Forest Management Project,China,VM0010,IFM,433518,1.0,68,0.8823529411764706,102,0.8910256410256411,156.0,0.11764705882352944
